item_id,item_title,item_price,item_desc,account_ID
77676337,Race.,403,Religious behavior thousand yet lose assume discussion.,17066693
90852541,Partner vote.,108,Challenge result office speech.,95096179
85986107,Arm Congress.,64,Become north activity onto.,95954547
12869992,Try increase.,426,Mr wind perhaps type. Amount teach truth feeling board yourself concern.,7126413
31655552,Design moment.,308,Whose half training political wrong there role middle.,12709786
3915554,Economy.,389,Tend themselves blood image during night. Simple real condition anything religious here and.,42134701
77905536,Four discussion.,204,Agreement service head energy go. Media thought point around.,64641409
6138363,Goal.,75,Late strategy allow have party fill.,53359612
7735905,Interview including.,345,Bring word girl Congress senior.,62695763
78087811,Cell whose.,26,Phone note affect government take computer.,39052605
62730396,Four mind.,411,Own serve themselves rather better race surface.,80046561
10634899,General sit.,380,Travel goal bit yard feel spring mouth. Watch relationship report.,88367453
6943134,How medical.,318,Degree today tend star white outside single.,2898063
4434191,Report dog.,340,Road you let key drive production focus. Audience quite ever prevent building.,7077845
87303131,Type prove.,241,Wear peace mean wish part ahead especially population.,5935819
19064710,Issue.,252,Condition rise analysis service hand city center. Worker store experience marriage.,18599169
9901223,Bill.,388,Congress themselves maybe tonight look lay something. This challenge into study probably choice debate.,94177954
48486590,Recent.,338,Year help age religious skill civil. Director discussion idea pick hear.,59467540
85849464,On benefit.,185,Career mission another up discover this.,97889205
61217331,North.,23,Think left military minute be later. Foreign property bed free.,3308691
60482075,Citizen book.,260,Remember letter daughter property world. Rate Mr moment tree.,10881187
76328671,Establish.,56,Their clear enough response.,35042259
66006411,Tell.,424,He situation method condition rather financial major level. International partner contain surface yourself use.,56872538
7666162,Student.,419,Let by receive measure without. Then opportunity recently or.,23194571
88358680,Deep.,367,Half morning cultural. Add above shoulder staff.,57593937
73285229,Vote.,369,American local let require political forward together provide.,75314583
77793560,Past.,195,Brother information manage rule subject Mrs.,82779801
85782259,West purpose.,294,Eat though wait worry Mrs experience.,24126663
95446394,Even what.,188,Market real miss star return race. Ago everyone artist you tell clear.,24527576
21588419,Officer.,345,Exactly window man issue. Religious care hold half know box relate represent.,68591120
35169499,Pick risk.,210,Call fine miss trouble push vote.,27005200
52976629,Dream three.,72,Us military opportunity career grow home.,32749632
35786757,Difficult.,293,Store dream economic whom according. Seat everyone try tell threat summer.,28379478
71509792,Check position.,24,Her behavior rise white protect require allow.,49840391
13998035,Power.,247,Structure small national add.,20291747
17781527,Wall again.,483,Particularly this travel effort little. Prepare wear simply stand key.,30154377
29758494,One.,161,Production second story debate student design. Claim poor whole international win.,887915
74675043,Check find.,297,Race find manage ago wonder. Candidate win prevent article and since city.,40598581
51104566,Theory.,79,Election girl Democrat under. Well scientist cover experience style suffer.,77648082
81879984,Really.,31,World free pressure event education food along. Plant look month Congress check join mission budget.,91270610
56768282,Law both.,53,Occur protect against note family.,26267753
70441178,And.,87,Brother strategy sometimes none source share. Her view hundred radio.,69609084
16312951,Picture.,414,Table doctor anyone magazine suffer that bring.,10979723
53821638,Media.,49,Newspaper simple yeah tend land camera.,65370384
47229877,Process training.,237,Official natural culture happen price consider. Raise tend central including near phone street.,84538987
94597929,Decision.,232,Place especially short buy book.,20092764
50111367,Stuff me.,405,Star each film right. Price first well recent cause.,90044441
596183,Still final.,151,Behavior cold view ball ahead.,59026440
65647721,Painting.,8,Able leave question way research challenge dinner.,5563784
73306955,Store decade.,273,Practice each from pressure.,5344956
93748148,List.,70,Series group newspaper up mouth coach. Direction Republican identify character money.,66578888
96003985,Than.,435,American worry actually late local smile. Industry avoid prepare.,56066005
3991015,Doctor.,79,Imagine song short market cell.,25980066
97220800,May.,168,Tough character possible mention support probably.,54736252
54726413,Some.,282,Peace good law week rate exactly. None security need air instead financial go.,4018926
59886785,Its.,230,Discussion man operation girl music gun must.,9042384
60942661,Trouble.,297,Clear that million college.,9521650
46297754,Peace.,309,Several it institution provide there fund resource.,69415784
17292351,Since.,111,Among thousand wish participant fund past write.,70249170
40519852,Miss low.,414,Develop leader hot parent country responsibility try.,96031650
34536308,Bit against.,96,Condition resource fish clearly huge.,6352301
4987529,May think.,177,Entire when report get significant few through. Base foreign lot into hair treat.,76814136
1106305,Heavy.,404,About eat whatever ever natural. Lose space apply level real and young.,85959552
3283011,Over.,81,Take likely hope. Activity data than focus turn range.,28424741
14450372,Girl firm.,477,Always exactly people.,67907434
48124287,Management various.,122,Across student short they. Might reveal professional offer toward anything room.,3568392
56950618,Eight.,268,Give something exist yard them.,47081284
81987757,Town.,159,Culture money grow big hard.,35468226
30321403,Worry.,168,Smile teach trade. Choice reduce happy.,42041634
11051626,Situation season.,276,Note information discussion here.,32813258
61715295,Must event.,425,Base card issue.,63319743
21032028,Program although.,360,Pass total at.,16356931
57748887,Practice product.,140,Coach stand day market course.,69686856
79537094,Me own.,496,Tonight administration learn amount control science second. Vote environment tax fly nice real.,1581300
76854477,Sound.,310,Contain possible forget bar.,63479997
40424712,Role.,279,Tree factor religious. Resource statement strong purpose black doctor.,21301056
99062026,Sign.,123,Enough type accept could.,89326565
47604988,Dream.,171,Sure open far investment husband all. Too edge exist teach.,91597946
75284725,Speech rise.,158,Imagine question everybody. Difference security hot at.,21671371
53443465,Keep sea.,431,Senior reach together poor often air.,75396374
84205957,Opportunity debate.,459,Ground business those article share customer yes more. Upon quality song culture reduce during.,44245757
43827725,Then thing.,138,Seek decide since grow.,86228190
74741786,As.,86,Here music simple have trouble your.,41133002
58583333,Shoulder.,363,Personal officer heart answer want daughter.,18727579
16781481,Pass.,119,Run thousand field suffer data wrong job build.,43864348
89417843,Keep source.,141,Law market attorney discover whom.,81859566
53926357,Reality he.,381,Development smile mother Democrat structure trial marriage.,99483081
53020727,Partner.,305,Close voice so air experience.,95489193
13507046,Street ever.,179,Issue wait political. Old product beautiful art join when boy relate.,83357763
94688108,Magazine guess.,382,Best effect economy. Must effort cultural.,32755862
55536097,Heart bag.,444,Five management open become physical. Present a certainly cup again back range.,49121506
49827019,Really decade.,73,None will hard important. Training nation player drop market.,26174389
44049959,Toward share.,374,Operation thousand yard least way new. Tough drop perform buy.,15867735
15036643,As.,442,Future but how third.,37585754
27831519,Person.,251,Across could Democrat onto hotel phone news nature. Position cultural nor director.,84752406
77036810,Against.,188,Reach policy how idea music.,70973600
90987915,Ready.,355,Skill street develop movie relate minute rule street. Process down result.,55094122
31340557,Follow back.,432,Interview strategy help director administration sport.,99587536
51209933,Parent region.,277,Turn yourself career enough time probably chance. Two huge line common full writer green.,86548885
95541587,Particular job.,398,History effort city.,38102967
28868804,Have.,223,Might condition grow soldier. Both learn son less trial country.,94315028
35731320,Magazine true.,93,Rule big such color effort.,7083075
21083341,Right standard.,328,Fly church manage security deep knowledge.,34550120
82280666,Spring.,394,End may official where until myself have. Sound magazine ball lose brother level must.,24439114
93805728,Pay southern.,183,Congress find fly north serve skill send traditional. Reveal teach difference system.,80816232
47999381,Cover cold.,241,Should campaign sit two drug less participant.,32324013
2401416,Big.,49,Son carry language receive eat music.,55599986
7032967,Low laugh.,356,Media news professional no.,58015278
86902076,Item.,254,Beat source up number.,970464
92956445,Impact.,158,Bill suffer data size kitchen stage difference.,39600424
11313960,Out.,367,After until thus week two they compare. Speech join collection position social number.,74391608
77003454,Likely game.,108,Among civil appear player until television attention. Represent product degree learn mouth.,819886
45677533,Both.,424,Return future marriage create second blood.,58514122
56248258,According.,99,Enter southern begin career.,12014163
69349522,Agree kitchen.,1,Tv word behavior decide.,50015542
80748731,Enter.,104,Situation view or.,2148526
50431625,Her.,167,Training bill seek long wall.,220941
68761745,During.,286,Floor activity interview health forward push. Especially establish tree reflect experience four operation.,45256912
35460060,Together.,227,Rock language culture fine through month tax. Performance alone civil song.,52910234
34530054,Claim.,95,Top address kitchen how.,62422444
78825512,Life.,65,Hair get test rise other rock send body. Western pick amount important.,67153251
33224909,Hand.,159,Ability structure field hotel mission rate. Official radio few box.,92112773
46535719,Must.,335,Inside them range explain.,47496118
39045027,Large.,106,Difference certain major none often will three. None station likely left analysis how.,1860528
22457929,Media.,455,Soldier with letter fill church college. Range federal wish look hand bar whom such.,43505616
31307802,Point space.,108,Discover senior effect tough grow Democrat thought. Writer avoid especially strong.,21247507
99090210,South best.,59,Hope watch control should threat fact. Occur language power.,10879283
61817272,However third.,123,Find majority morning specific hard if.,45601378
21531354,After.,171,Whatever follow society thank institution seem green price. Rule political early fact.,87254570
64108766,Thing.,245,Board resource policy note word. Camera per property car finally person.,74042845
62962230,Bit less.,29,Federal agreement watch born alone. Where clear we action bar wall discover.,28816287
98635214,Adult.,15,Responsibility whom wrong apply put way. Again rate human arm realize important.,78152328
11882626,Trial sea.,349,Church itself lead line themselves. Trial wrong finally soon box energy north.,61670075
645881,Half.,402,Recognize threat none leader. Budget hundred I space stay.,22750785
30621596,Provide science.,63,Leave range bar realize.,92587960
29664047,General too.,422,Understand media local popular hospital federal single.,76198113
44175719,Yes do.,431,Buy sister me head. Option tell art soldier.,52469909
1692761,Participant bed.,431,Focus business personal focus president none car.,85944138
5580620,Raise.,340,Student project real article product teacher.,59061229
96860823,Analysis determine.,164,Threat everything really check modern lawyer deep lay. Particular attack visit use agent ability animal less.,22869609
45065774,Contain across.,419,All reach exist first owner decide. Enter with much understand medical watch player.,52445576
7833748,Suddenly dream.,136,Role future indicate newspaper. Area top work rest reason study fine dinner.,82404611
33337944,Debate significant.,142,Network natural foot order another move whom.,79766968
2562698,Pressure.,153,Hear student west it game check daughter. Space outside fine.,79332828
68882884,During resource.,442,Area that player half out.,98697540
61491458,Happy easy.,76,Show game ever almost attack management. Forget to claim often account tough subject safe.,90386244
35799771,Score.,206,Wish of evidence four agency fly. Sit according occur hard treat.,55251471
24612654,Idea.,440,Example grow gun size state poor assume. Executive hotel plan pay determine human.,75052317
10261361,Son father.,374,Positive evening shake anything.,82388232
4972037,Bad give.,349,Approach between short pass leave. Focus finally training blue wife take.,59695493
64631936,Conference.,130,Agent year administration fly book tonight.,20659110
21450631,Cup.,125,Head it data chair yard page arrive under.,22000170
88669458,Throw.,10,Wish travel claim type big maintain.,74683277
44875688,Know attention.,165,Office evidence Democrat.,31338226
18101157,Safe science.,459,Above finally loss you from may treat. International memory five particularly.,60165190
84870476,Evening.,181,Memory trip artist least. Reach deep place we her physical.,89645468
87356694,Nothing.,381,Democrat require interview weight quite energy. Form school happen.,73791737
465090,Actually.,61,Wonder what this majority trouble great. Environment base seat around.,69006852
13893019,End executive.,133,Card the sing office college someone.,72478905
70486063,Tree.,272,Out so president after but. Body night defense amount.,59488224
19162287,Think.,297,Up who night officer structure course.,1674903
43019083,Else.,15,Certainly per nor seek throughout seven lead build. Ok glass staff if song of some daughter.,54848542
88823164,Process.,146,Professional site size necessary perform season.,72825945
80200802,While better.,323,Crime activity note baby finish work.,35435686
47925243,Book fear.,452,Wrong know name significant important kid. Seven political nor million.,84337948
88769776,Can.,46,Debate describe you character. Soldier report him parent discuss husband TV.,98460069
65523995,Collection sit.,314,Per public they do. Run look sound dinner point range cause.,89331637
31489065,Education animal.,103,Happy reach go amount thus.,41989470
57055169,Include six.,158,Energy fly measure style beat. Kid far fight natural they staff score bar.,37787684
29424504,Send.,69,Near this individual agree become prove.,4306924
61654419,News probably.,293,Present heavy physical spring American create.,19486345
44497392,Determine act.,279,Offer understand edge. Consider down sometimes suddenly popular democratic.,99183783
37959784,Three tell.,18,Design gun economic fall. Spend cold itself.,47928480
31826853,Blood.,212,Tree who sometimes. Administration some series lead law partner.,88620459
58177372,Tell pull.,212,Serious want money store board put community.,39354372
68416928,Public visit.,140,Certainly message goal now grow you.,33591308
86358736,Low.,420,Seem usually near. Pressure authority free significant small.,11321163
28934950,Local.,380,Common onto raise whom bit. Could political never western.,30299801
33033440,Catch.,257,Prevent beyond much send sure.,40076966
95662565,Exactly audience.,334,Put green win tax plant letter. Culture near economic use sound.,38709302
6208660,Employee.,472,Draw play office answer.,42063582
73403630,Level.,385,Choice store yourself about good capital travel family.,8177797
61052185,Set.,125,Teacher around debate someone church commercial. If face traditional than listen increase.,93974905
5790142,Arrive side.,439,History smile contain media employee east base. Why four design support as send.,56086164
5214976,Hundred.,306,Actually wife assume its side modern page edge. Class me remain.,62562706
70203042,Low just.,84,Increase audience family camera for economy. Section enjoy home century doctor.,64854038
46867445,Imagine perhaps.,75,Color wide own phone.,61204171
66738008,Activity.,22,Paper risk voice statement.,64307718
97820567,Century.,76,Point edge son necessary. Provide want smile president.,95153797
82883591,Happy ball.,248,Opportunity eight never business room federal however.,28271826
55429313,Left.,231,Performance guess church head beat economic change. Article agree public record beautiful capital debate.,38321757
18346497,Really.,155,Entire leave idea month black perform role.,85623989
39204646,Across.,437,Mrs letter own speak water special. Market fast law huge growth total sure.,1990874
19311241,Air difference.,474,Newspaper administration ok class.,10010884
93478021,Agent.,415,Free number inside almost young but spring. Government cause direction involve form through.,4888345
90740442,Address across.,266,Process plant from. Office business out degree character.,11688228
34959251,Information.,285,Go such check world medical.,68815400
81060863,Old service.,3,Financial lose way game lose.,11667018
30092563,About.,108,Part yet herself matter. Back report own free themselves visit a.,91626745
8142832,Break.,296,Continue industry treat soldier. Who talk sit hundred run she.,27282977
21591396,Catch.,241,Deal political list difficult story when.,38730801
63917185,Arrive if.,25,Claim industry direction.,94483642
93399944,Hard.,315,Hard word international bank. Since when trade only bring.,89955055
78391369,Than seat.,72,Box political laugh. Visit half pretty thousand.,31225793
55109277,Run too.,63,Score thus man fire natural only.,80764663
46940193,Long.,39,Spend war offer sure size magazine throw. Special this a PM together return.,82760403
99492557,Decision lay.,302,Source find public couple. Old two sort who.,32977776
43277353,Quite.,288,Sound star cell cold line know teach door.,98324828
41020685,Someone this.,319,Talk wear seat believe face teacher explain. Full take return no seem.,64300078
12826919,Lead.,92,Pay cell result upon any pattern today lose. Today travel woman throughout which.,69181856
43930494,Ago.,367,Official per blood wonder reveal character despite. Season today great education spend.,86552868
90366628,Very she.,331,Mrs middle talk cultural else position for. Sit choose enter social.,97952282
75433406,Build mouth.,340,Scene order evidence expert gun open ask.,16532939
37383350,Far.,33,Season stand grow social thank leader behind. Why concern test worry.,28332176
80224068,How amount.,222,Because use letter past from able. Green especially usually too natural concern some population.,54983496
97905677,Mention.,447,Employee significant place.,28580317
42092919,Democrat.,261,Table test prepare subject bank half.,33030494
74485086,Let.,5,Doctor upon small however say seem. Deal again trial help generation second together.,670197
8512352,Mean return.,323,Blood weight economy green think.,9278097
82443245,Could.,242,Past trial there less reduce wind mind.,89238592
18932355,Have option.,125,Fast cultural professor check hospital.,95233963
2541051,Believe.,418,Need hot field decision music. Everyone however popular scene unit member up behavior.,59659723
43360314,Red fast.,289,Enjoy oil common help away hit.,37582081
69392207,Training eight.,443,Word down against across. Billion upon decision ask poor out necessary.,72968802
9408265,Fish above.,319,Detail more wait project before husband research.,12901760
18043112,Might.,384,Visit capital kind house speak produce remain. Trip full right perform eight.,3266748
10755945,Possible clear.,87,Among different service heart doctor.,75406271
9459441,Program series.,83,Home right reduce boy friend. Huge lay study fact political.,34214695
53593856,Two make.,179,Five late boy.,89174531
75454777,Power.,71,Sit party five.,37657796
92203105,Possible.,24,Much by player decade attack recent anything.,13408695
60245021,Series series.,114,If team action hair feeling three. Recognize participant matter state.,71514741
20414221,Do.,237,Network factor media same compare manage. Soon foreign represent smile.,96160794
99370763,Few family.,467,Herself clearly since between. Up wide again indicate military.,59289432
76035258,Prepare member.,447,Catch physical moment time medical data indeed. For word them issue strategy major.,47998681
77642004,Specific.,420,Great seven push within.,54320123
89454459,Project different.,303,Approach produce organization commercial fly. Discover million stock let each.,67409020
52033438,Lead themselves.,383,Tax strategy recent question production. Religious store include care instead these image through.,59502845
94220520,Sort offer.,218,History raise control begin star effect positive. Cost impact statement quickly pretty science notice office.,21757525
41859803,Degree each.,480,Should offer where learn. Suddenly assume visit fund their tend.,23917675
28517214,Cup.,271,Similar wish coach friend perform notice. Soldier agency suddenly design man much.,76975202
37772369,Bill.,371,Would me finally difficult into factor continue. Water number might work walk.,75869755
90602474,Body standard.,33,Start marriage adult at present.,21328480
40418551,Table pick.,235,Mean first picture girl ball reason listen.,23891036
79868754,End number.,469,Piece coach source town woman quality miss.,7931673
90878374,Agency guy.,330,Make play parent leg yard material economic. Per radio between.,78211599
45855047,Wide answer.,165,There business character oil Mrs southern. Theory across blood guess western task.,73026617
84722355,Away.,385,Thought follow before mean.,86910958
66771067,Guess company.,198,Cover read season type senior star. Well bed owner rest.,39095220
76406683,Different.,392,If method middle since per.,21690730
3046982,Wait Mrs.,436,Girl century money any model.,67877799
25033557,Eight activity.,210,Place find character federal ago.,21328688
56395983,Reflect commercial.,290,Send produce reduce.,80322566
86667388,Window interesting.,218,Imagine edge she including risk cold.,44004798
20710941,Week apply.,40,Fund low job will myself style keep black. Oil boy wrong.,49896176
75502997,Deal event.,466,Must between to room.,61222403
84269188,Trouble ten.,60,Training consumer plant.,88960371
74686698,Answer win.,339,Option audience camera identify could meet cause. Question contain book order.,16298163
80954279,Truth.,251,Bar light situation finally. Morning TV according computer name reveal.,81687879
80004615,New red.,244,Fish that expect voice practice thing. Turn speak wide accept thank relate.,47296169
3966655,Fish.,161,Who until rock young. Among mind result southern several follow less.,27392119
10554517,Call.,115,Debate themselves Mrs long statement. Per somebody fall account new camera.,77655127
41039342,For loss.,204,Kid property position.,78059245
42623557,Family cover.,165,Become best think over.,71726526
9922839,Say.,179,Baby another under whom able. Together later everyone.,15311566
15791801,Focus they.,202,Yet environment prove health action.,59376842
86406383,Box approach.,253,Responsibility talk across worker conference. Hand position which answer.,87950717
26688091,According.,401,Them gun minute most career such fill.,51584245
64982786,Chair.,332,Half management against way wish Democrat.,75792053
62212519,Admit.,14,Receive term each particular election race world. Service brother wish player.,21722516
10633137,Thousand career.,123,Something human six catch or everyone level oil.,96231166
14416996,Painting sell.,288,Current they paper these. Word pass need truth.,28106593
52052675,Civil.,64,Method dinner instead car learn success team already.,42066255
76285967,Something.,100,Final put material time key.,83172472
81971268,Direction if.,113,Hundred carry little sister school.,10153987
16375734,Still.,89,Democratic it high usually cell because. Southern itself allow throw strategy.,95802435
90222382,Crime rather.,249,Civil medical cold whole program yes politics.,41108277
43647507,Official maybe.,443,Concern cost single power once.,98589913
38204944,Person.,367,Door statement finish human enough north.,47424463
33375724,Candidate run.,43,Scene arrive hear near son Congress nature do. Start couple natural team woman.,8670144
54371866,Mean.,204,Check chance low they late others final try.,54993235
56665659,Maybe arrive.,52,Choose and head ten. Nation beyond economic how.,70122886
7769160,Air ground.,343,Eat fly office door will accept specific crime.,82279011
21715396,Role.,232,Crime memory nice result national.,72820049
41633366,Often them.,446,Save cut pass action.,20618353
24796408,Book best.,378,Protect between money hope. Actually nearly drug most present himself simply cold.,89132586
97943167,Behavior.,406,Local for kid important determine check. Player city short individual debate after bad.,69968624
60582157,His.,24,How throw letter nor.,51024680
56189360,Early.,379,American floor bit continue. Admit song treatment stock probably alone trouble.,90443107
49111828,Always.,124,For sport brother gun Republican expect check. Soon quality sit ready issue other.,54971936
66044673,Tax ability.,195,Accept program compare.,44737412
96095751,Want.,294,Our turn order always.,74235339
68977276,Front.,225,Model agent main throw police. Somebody hour despite hold scene describe.,60951960
57807416,Itself.,198,Require strategy mission.,2311425
31658102,Themselves.,52,Maintain himself tough station.,28096634
99636524,Out debate.,222,Five him glass decision my. Rather say theory establish director present customer.,17328654
86170338,Move.,83,Thank life bar other wish light prove.,74526024
