item_id,item_title,item_price,item_desc,account_ID
62944137,Clear line.,185,Group growth science street child.,58703403
24389648,Picture program.,391,Reflect win watch include might.,82653828
81031979,Country.,230,Tough back from few.,13315634
37534899,Life.,380,Benefit save role war seven summer full above.,89822951
44190927,Girl about.,194,Other choice coach gun. Interest right eight.,49985450
28766414,Serve travel.,200,Everything none always name. I use unit low.,33047997
20160890,Mission.,83,Hear product teach born growth. Teacher last pattern foot policy about.,32187984
23399990,Detail.,105,Continue would majority believe summer off half. Strong case yeah increase.,89599884
59994466,Somebody stock.,294,Another think nearly onto. What glass politics per.,59747888
14973604,Attorney health.,70,Vote prove develop nearly admit language exactly. Edge treatment unit skin.,5270668
88176222,Interview.,168,Suddenly cup time kid too. Prove individual hotel professional development outside beat event.,44995423
2115665,Police century.,67,Get court far tonight leave treat.,95708409
3214596,Mission.,317,Nice quite summer source young.,8826374
18070514,For.,86,Page voice policy level federal build. Bed imagine always.,1803853
65077771,Concern up.,420,First walk they able. Heavy treat those drug success world some piece.,92706187
72259917,Stay whose.,425,Find focus work type. Society couple half.,21386510
61822177,Identify likely.,427,Station four put out lawyer standard set.,20753511
47054059,Nothing fight.,101,Window message economic office break seat. Car century recognize size.,29118106
24744799,More.,198,Ago writer high pick little. High no much film place.,57013282
28803737,Hold music.,330,Who ever little.,93120975
47921740,Quite.,339,Increase fall perhaps north half per form. Water trip member understand for same baby.,83482502
70246063,Like offer.,349,Somebody bag create claim money.,39930231
35282167,Space.,106,Several quickly health nation will.,43490028
49031744,Effort.,6,Skill play bit court part continue.,77473974
35418856,Discuss.,456,Even exist interesting chair animal.,16820005
62843829,Indeed.,360,Six available sure TV religious friend. The daughter I stay.,59497905
52664434,Tend.,329,Small interest clearly still mother behavior alone him. Black parent minute knowledge cut forget shake.,79833066
37385194,Available common.,320,Watch woman shoulder culture him history music act.,18896411
28248712,Study a.,288,Executive day enough its economy sea. Several benefit company particular buy rate.,51960315
84785701,Defense.,84,Fear send many travel.,65962787
80786115,Entire.,168,Easy special where fall leg on school view. Leave really five do.,55981606
22269751,Can.,369,Onto child computer road policy.,2448787
32079593,Among.,38,Training born skill her yeah provide send. Still news human skill strong.,52716683
55346689,Visit several.,118,Down federal mention.,30926059
11312864,Take consider.,110,Carry consider group record report. Wrong very hear move.,50003372
55870603,Commercial.,351,By minute age turn floor.,84004574
31789684,Simple nearly.,145,Care number glass man front season air.,13912260
80964803,Add miss.,268,Black stay still day card sometimes window sometimes. Exactly radio wife away produce hard something.,5370535
77022356,Parent.,242,Area thing figure safe. Small color easy.,43219858
17449465,Name.,463,Truth either rest.,23354418
15643742,Five.,447,Edge part candidate have. List time citizen dog.,94809916
41074466,Care.,301,Trouble direction economic store back assume. Later admit history positive.,2436326
13275075,Senior president.,70,Especially standard church particular door. Many anything maintain yet.,8960597
54298859,Loss back.,285,Shake agree woman onto late. Almost develop put prepare.,29041022
97738688,Card.,391,Fire couple itself expert enough try.,25833621
70131413,Make product.,72,Moment commercial become especially value whose.,93568807
15092724,Serious.,56,Team religious modern three hit laugh off. Media or life film majority group bit research.,71584287
23302013,Task.,191,Car such grow vote.,47882560
65476239,Policy.,88,Sea couple ground late. Discussion billion positive rich simple design side.,71462714
40065731,Baby.,316,Television style enough one new moment dream. Fight and claim trade.,93026567
9288362,Deal money.,404,News phone range here. Couple even exist choose rich loss white.,9034495
16248427,Well.,383,Capital actually reality scene wear.,64353555
36031658,Expert different.,94,Majority management five shake or Democrat difficult work.,87633184
87906400,Beyond language.,330,Community nice view phone model. Free upon like left realize no race it.,83787874
47154902,Question poor.,287,Interest almost perform ask amount onto. Take same final west city front.,24317252
48114240,Community.,209,Work relate take theory.,87938876
31214285,Maintain.,444,Owner point now account social century.,82032074
29564613,Yard water.,334,Husband five charge today generation. Your food expert.,11079750
20132576,Decision to.,203,Include save act general trial. Bill hospital dream democratic.,76344626
34015889,Style reveal.,154,Theory international technology box nice hand risk.,60951625
64256894,Audience.,393,Nation ability best purpose yourself subject treatment movement. Couple opportunity join camera receive.,44255701
20323264,Piece.,453,Probably reason some use radio however final us. West early on yes force far finally.,36055227
2182803,Effect eight.,322,Former fill race. First fish know thing.,46786173
16826601,Officer behind.,262,Yourself artist station address away.,48679190
14090493,Energy hand.,491,Religious day garden effect surface whatever race difference.,83910555
64711416,Market.,299,Performance seven song still community.,37798338
85677654,This leave.,342,Radio act nor.,34500491
90836671,Imagine security.,105,Who article stop respond me hand reason purpose.,82274849
25865707,Similar set.,46,Care treatment street professional ability something.,81172238
31254076,Music.,8,Set law dog them institution stage save.,21877629
20880118,Field.,71,Future amount what.,5610822
77510433,Popular.,420,Quickly century alone.,88319100
26116044,Power.,158,Discussion top late.,31140188
85926141,Property.,81,Eye which experience none design spend.,19242224
10362280,Standard.,340,Without talk resource both way candidate support.,28167693
14787331,Present according.,229,Actually necessary arrive.,44428259
95593289,Street because.,389,Series ago some over a care lose. Affect city when huge know exist either.,52349164
30690264,Tough effort.,264,Professional serious short system mission. Lay serve return late design inside.,38730016
10726921,Really.,136,Would their prepare. Lose maybe explain yourself much.,58623268
88861487,Whose.,201,Current little event.,18732764
36905898,Style hit.,32,Common own several difficult protect should skin sit. Oil happen time hope.,86373098
98011117,Show member.,288,Fall everybody ten couple.,42942665
48394161,Popular.,293,Check quite rest sign offer ten anyone. Sport another school issue meeting question region.,84131690
35280989,Reach.,460,Arrive choice there body week operation help.,70506075
30035478,Book according.,465,Treatment buy building production miss. Never sound impact behind.,38997570
7968839,Keep modern.,148,Modern board off. Traditional increase possible wall true somebody.,2225623
67835478,Man else.,347,Six smile ahead compare country relationship. Most body agency happy.,68668204
94883213,Approach politics.,69,Treat family contain fish book.,85126107
80013631,Discuss meet.,300,Floor figure fall each.,2630533
78156692,Election.,397,Accept too per development. Maintain out matter pattern.,69235399
64017778,New.,249,Daughter behavior traditional fill mother these subject.,44157098
62099622,Himself town.,427,True sense side goal draw. Top check throughout.,56372694
43363643,Impact wonder.,423,Pressure professor father reason. High continue modern much situation tax law draw.,17641333
97003083,Good.,220,Walk treatment knowledge growth it.,4758501
30509498,Want.,498,Significant push window offer director.,87618839
21528002,Health director.,484,Expect public fear environmental should good.,74072446
1053753,Floor lose.,305,Another mean around music owner.,57280677
77163486,Involve.,386,Place number season many.,70989632
8380081,Cause.,446,Type image pattern clear major rather.,49296099
31894449,Instead trip.,275,Get city computer hear.,69043208
62297981,Capital.,483,Positive in media and near democratic.,14527951
96614082,Open.,379,Up light class child certain avoid person.,74013340
55445382,Under person.,189,Party development American fall.,29780648
45221354,Today.,408,Catch similar teach light south.,37187163
97490791,Career how.,228,But daughter or recognize pattern long claim.,43536481
44065348,Theory experience.,473,Control whose not me. Study be form need significant capital occur.,37263195
32379495,Southern.,424,Around report education it mean.,41678763
99491635,Simple.,447,Know effect fall involve offer behavior stuff.,94542554
65670705,Choose process.,133,Again soldier girl rather fear. Others huge model three.,396516
14607554,Maintain.,274,Friend should cost.,79496674
23763364,Prove.,112,Mother begin address college actually commercial series station.,93367974
99369163,Different or.,226,Receive site half.,72705254
21540837,North.,328,Sense wrong real baby.,63532913
73656746,Plant.,265,Group with continue just when executive box.,65071670
74125722,Early.,363,Truth them production low operation. Poor foot way face money decision.,97222774
1693218,Answer.,113,Close break research sign. Employee top wrong responsibility college war.,50450077
21519963,Ever.,390,Hot eat interest never.,29582921
17406468,Question.,5,Live at source story dream life stuff.,7277375
69343650,Economic.,254,Challenge article head with.,7386824
36859078,Top view.,64,Trouble return sound listen onto and visit. And artist for whether.,86822671
34373521,Understand computer.,157,Continue should door since clear explain. Response expect and model crime pull risk would.,75354688
17822367,Child deep.,298,Effect building rule fall ever. Think yet determine task reality take position cover.,96817285
78529953,Modern.,186,Mr Mrs and short.,59512356
47237421,Environment.,440,Production lawyer small read team provide. Also reality bank push guy sure.,31409087
54229112,And.,496,Very station subject. But sport work own always.,24387149
51939939,Agree.,36,Place job find operation choose.,43641185
47596788,Professor per.,62,Involve enough film source. Media officer white executive important level.,28750062
20379179,Necessary.,433,Whatever option serious skill weight.,49246346
83225376,Nearly event.,55,Think think property firm away apply treatment later.,90420290
13312596,Never bar.,276,Office place many yourself skill strong. Exist number most serious movement if place.,56810288
57424200,Affect.,415,Most action million always yes go.,13270728
97966838,View.,137,Report whom machine Congress outside cover attention.,70612424
9170421,Word two.,95,Station more admit pay high. Pick raise deep kind matter writer.,77622327
3574485,Teacher.,164,Once bar pass final.,41516669
72876558,Pull also.,118,Education bag million minute various. Lot night write.,31478618
67720187,Small.,473,Whom large push sell trouble thing.,59419150
57470184,Service offer.,287,Close exactly walk actually. Different foot laugh apply relate energy lot.,78517622
48627696,Eye but.,252,Stand head alone sign drive other. Alone travel economic rest cultural.,29251988
79361330,Public him.,446,Because exist position.,12293889
81407637,Prevent.,104,Project most clear or term.,67875177
15163240,Offer full.,138,Middle event right seat economic administration west.,87003680
92319172,Anyone.,369,Institution rather citizen anything soldier people. Firm fear law animal.,89085509
32140934,Stop power.,271,Later process rule financial.,16333048
57962924,Require foreign.,457,Lose strong newspaper ten. Finally general economy lot consumer themselves.,13834609
11791836,Worry.,380,Like difference little we soldier. Event organization boy choice still discover night.,3262863
10499603,Security itself.,152,Message or unit scene realize.,29377350
83504112,Into social.,456,Particular form positive unit star. Serve building people seven put.,80986386
29412594,Peace.,240,Million reason cover music and.,1646214
5011339,Attorney teacher.,87,Cut child heart opportunity itself population. Reflect PM place tend.,53581761
38092343,Animal.,293,Mission want mind than back result final. Remember five item office.,97441878
13509033,Nothing.,233,Nearly enjoy career note.,9975491
9496446,Issue.,181,Represent floor fill its.,18340730
46760944,Next four.,81,Whole north yard.,18083972
17537735,At generation.,17,Way myself account personal.,86787086
72508244,Miss.,107,Himself recognize religious woman. Husband behavior possible none memory Republican clear give.,33884004
62828314,Decide high.,373,Opportunity lead anyone. Political enter line firm its maybe wear.,62966313
24541084,Develop to.,83,Shoulder administration we business. Couple something community computer baby cup boy.,18154610
87064506,Develop.,329,Response keep enough check. Gun executive believe make.,63893250
94110593,Deep already.,324,Success fire summer effort card. Test raise paper deal.,60850256
32997132,Under.,429,Think site carry court community before. Major statement around audience after between present.,18831153
93737678,Nature.,141,Television opportunity past team speech. Could reveal education international.,67572687
2465838,Science.,390,Allow remain discussion fly other figure animal.,80573319
39028105,Record.,313,Dog security example TV all.,23429291
69780066,Catch.,308,Design likely unit war avoid.,56888461
6698379,Data.,461,Source air fire her already represent theory.,21458750
22944269,It again.,337,Those despite southern military despite.,75647766
81183166,Financial card.,156,Think everyone send.,93964807
18513387,Hospital often.,259,Director per time clear.,97937821
55113205,Short painting.,56,Majority at seat stage commercial natural.,42887003
79970174,Develop.,438,Me woman color among news.,29829828
82600600,Bed after.,432,Determine every ten company low sea try will. Charge husband tell mission.,89773307
51956646,Nearly interesting.,423,Pick others face imagine.,4812449
58393895,Always use.,448,Decision picture glass very election reduce just.,43575510
70329988,Assume.,225,Because activity walk black ever she already.,56926743
61680364,Soldier hear.,372,Citizen challenge question. Almost care campaign wish at.,57320946
70937213,Ask information.,486,Class both they less on war mouth. Open alone now agreement need.,18943733
37895686,Animal.,440,Newspaper with fish floor space system operation. Standard effect center concern.,17307000
50782666,Voice whole.,428,Professional door open right involve government.,53775627
57184944,Senior finally.,341,Although wait well within cause father once. Once continue front year board production.,64199177
4662327,Remain.,24,Expert everybody five involve great behavior other. Forget well despite bad college record six finish.,60457325
53001863,Top dinner.,148,Property day leg series describe management avoid.,64756363
57046532,Amount answer.,363,Evening each know girl clearly sort capital.,4082569
6473396,Subject participant.,216,Training together entire agree mother especially.,40056227
80914167,Indicate.,210,Small home style improve should model among.,31678636
29895007,Just behind.,21,Kitchen investment with carry. After after tell important vote star.,53584441
70824285,Coach.,325,Financial expert hold head. Indeed above turn many.,56027174
70795592,Strong necessary.,364,Include soon morning method various white.,86478960
17373555,Development summer.,427,Drug realize ask scientist include should your someone. Beat bar rich good ago son seem.,46363244
19083155,Indicate might.,213,To number type guess analysis appear. Space scene name drug good.,31823241
77129222,Full.,306,Agency statement air gas. Prepare traditional partner interesting skill.,14227257
69663345,Charge know.,211,Mind company expert miss this no ability power. Happen oil especially.,55220149
24783231,Teach.,363,This television child write impact environmental.,81578221
94609400,In.,63,Computer a guess. Consider nice machine result Republican.,86384773
55250290,Experience number.,2,Year including matter send perhaps light agree cost. Represent decision theory phone involve fast success market.,63299304
17584135,Program.,405,Seek guess recognize out. Report last easy day imagine other argue whether.,47337343
58931516,Bed.,207,Ten method four relationship.,65873939
79489775,Investment.,76,While as so type throw.,78836273
10780480,I.,70,Coach law effect throw company nature. Must seek represent week society read.,82227531
93789615,World everybody.,31,Point affect director compare likely.,97860792
53463357,Artist system.,82,Past street peace writer box five Congress same. Vote discussion without site cold appear fight change.,23993846
20959517,Republican among.,364,Poor special stage minute cold coach but.,159708
70181814,Data month.,278,Religious station test main. Key foot truth thank her Mrs.,82328375
95175065,Manager story.,278,Act present more.,23503786
22464958,Sound.,353,Feeling moment raise dog person.,2989099
63157505,Technology a.,68,Get follow window how.,55590617
98478866,Score.,381,Style security consumer national a.,57471815
3935743,Buy.,238,Another ever south of hour business. Doctor quite family site hour sort manager.,30466029
16293540,Other computer.,18,Ahead take certainly surface behind news.,55606912
